{
  "schemaVersion": 1,
  "synthetic": true,
  "domain": "validation",
  "cases": [
    {
      "id": "structured-pass",
      "initial": {
        "input": {
          "expected": 42
        },
        "result": {
          "answer": 42
        }
      },
      "action": {
        "operation": "evaluate",
        "shape": "OutputShape",
        "policy": "ValidationPolicy"
      },
      "expected": {
        "verdict": "PASS",
        "reason": "PASS",
        "failedPredicate": null
      },
      "events": [],
      "error": null
    },
    {
      "id": "structured-fail",
      "initial": {
        "input": {
          "expected": 42
        },
        "result": {
          "answer": 41
        }
      },
      "action": {
        "operation": "evaluate",
        "shape": "OutputShape",
        "policy": "ValidationPolicy"
      },
      "expected": {
        "verdict": "FAIL",
        "reason": "PREDICATE_FAILED",
        "failedPredicate": 0
      },
      "events": [],
      "error": null
    },
    {
      "id": "structured-extra-field",
      "initial": {
        "input": {
          "expected": 42
        },
        "result": {
          "answer": 42,
          "extra": true
        }
      },
      "action": {
        "operation": "evaluate",
        "shape": "OutputShape",
        "policy": "ValidationPolicy"
      },
      "expected": {
        "verdict": "FAIL",
        "reason": "SCHEMA_MISMATCH",
        "failedPredicate": null
      },
      "events": [],
      "error": null
    },
    {
      "id": "unavailable-artifact",
      "initial": {
        "resultAvailable": false
      },
      "action": {
        "operation": "evaluate"
      },
      "expected": {
        "verdict": null,
        "effect": "WAIT_UNTIL_VALIDATION_DEADLINE"
      },
      "events": [],
      "error": null
    },
    {
      "id": "policy-digest-mismatch",
      "initial": {
        "policyDigestMatches": false
      },
      "action": {
        "operation": "evaluate"
      },
      "expected": {
        "verdict": null,
        "effect": "WAIT_UNTIL_VALIDATION_DEADLINE"
      },
      "events": [],
      "error": null
    },
    {
      "id": "duplicate-result-keys",
      "initial": {
        "input": {
          "expected": 42
        },
        "resultBytes": "{\"answer\":42,\"answer\":41}"
      },
      "action": {
        "operation": "evaluate"
      },
      "expected": {
        "verdict": "FAIL",
        "reason": "RESULT_INVALID_JSON",
        "failedPredicate": null
      },
      "events": [],
      "error": null
    },
    {
      "id": "float-result-rejected",
      "initial": {
        "input": {
          "expected": 42
        },
        "resultBytes": "{\"answer\":42.0}"
      },
      "action": {
        "operation": "evaluate"
      },
      "expected": {
        "verdict": "FAIL",
        "reason": "RESULT_INVALID_JSON",
        "failedPredicate": null
      },
      "events": [],
      "error": null
    },
    {
      "id": "missing-output-pointer",
      "initial": {
        "input": {
          "expected": 42
        },
        "result": {
          "answer": 42
        }
      },
      "action": {
        "operation": "evaluate",
        "outputPointer": "/missing"
      },
      "expected": {
        "verdict": "FAIL",
        "reason": "PREDICATE_FAILED",
        "failedPredicate": 0
      },
      "events": [],
      "error": null
    },
    {
      "id": "result-one-byte-over",
      "initial": {
        "resultBytesLength": 1048577,
        "digestMatches": true
      },
      "action": {
        "operation": "evaluate"
      },
      "expected": {
        "verdict": "FAIL",
        "reason": "RESULT_LIMIT",
        "failedPredicate": null
      },
      "events": [],
      "error": null
    }
  ]
}
